{
  "id": "a69fc4b7-ac59-8d37-954c-2e53efd1bda6",
  "claimId": "fbe7ce66-ef39-848d-8426-b7f2643315b6",
  "kind": "test",
  "locator": {
    "type": "command",
    "command": "node scripts/verify-completed-audit.mjs && node --test packages/ui/lib/completed-audit*.test.mjs"
  },
  "test": {
    "level": "integration",
    "description": "Check that the audit includes every earlier requirement and keeps missing proof visible.",
    "source": {
      "path": "scripts/verify-completed-audit.mjs"
    },
    "inputs": "The current requirements for the eight earlier workstreams and their recorded audit.",
    "expected": "Every requirement appears once with unchanged wording, its actual check links, an explained judgment and readable supporting files. An omitted requirement or invented mapping fails."
  },
  "migration": {
    "origins": {
      "e55f1c9afd4f97d11e764eb0afafb544d4eedda1": {
        "path": ".spec-ledger/bindings/B-SL-028.json",
        "id": "b-sl-028",
        "sha256": "ee31eb879e442d8d076caee32848aa342d2ec91885d704751ab0923e341466c2"
      },
      "77e6ea9e209ed85611befed63e413aff34e56d46": {
        "path": ".spec-ledger/bindings/B-SL-028.json",
        "id": "b-sl-028",
        "sha256": "ee31eb879e442d8d076caee32848aa342d2ec91885d704751ab0923e341466c2"
      }
    },
    "historical": true
  }
}
